time_stamp,task_name,task_seed,base_llm,agent_name,domain_name,user_name,source,semantic_keys,hint
June 4,miniwob.book-flight,2,claude-3-7-sonnet-20250219,MultiToolUse-claude-3-7-sonnet-20250219,miniwob,miniwob,allac,drop down menu,"some drop down menu will have a list of choice to select from, after typing. Make sure you select an element from that list."
June 4,miniwob.book-flight,2,claude-3-7-sonnet-20250219,MultiToolUse-claude-3-7-sonnet-20250219,miniwob,miniwob,allac,Filling up form,Make sure the correct field is activated with a blue rectangle around it before writing into it. Not because the mouse is over it that it is active.
June 4,miniwob.book-flight,2,claude-3-7-sonnet-20250219,MultiToolUse-claude-3-7-sonnet-20250219,miniwob,miniwob,allac,Filling up form,GUI elements surrounded by a red rectangle often means there is an error in the content
June 4,miniwob.book-flight,2,claude-3-7-sonnet-20250219,MultiToolUse-claude-3-7-sonnet-20250219,miniwob,miniwob,allac,Search results,The scroll bar indicates that there is more than 1 flights available in the search. Make sure to select the one matching the task goal among all possible flights. 
June 7,miniwob.book-flight,2,claude-3-7-sonnet-20250219,MultiToolUse-claude-3-7-sonnet-20250219,miniwob,miniwob,allac,Filling up form,"If you suspect an error in an element of a form, ""ControlOrMeta+a"" to select all and overwrite the content"
June 9,miniwob.book-flight,2,claude-3-7-sonnet-20250219,MultiToolUse-claude-3-7-sonnet-20250219,miniwob,miniwob,allac,Filling up form,"The main mistake is to type in the wrong field. Make sure the correct field is activated by clicking into it and seeing it activated with a blue rectangle before proceeding with writing. Otherwise, it will append to the currently activated field."
June 11,miniwob.drag-items-grid,30,claude-3-7-sonnet-20250219,MultiToolUse-claude-3-7-sonnet-20250219,miniwob,miniwob,aman,Dragging items,"For dragging tasks, use only mouse_down, move_mouse, and mouse_up. Do not perform a single continuous drag. Instead, move the mouse in steps using move_mouse, and then release with mouse_up when the target is reached."
June 11,miniwob.drag-items-grid,30,claude-3-7-sonnet-20250219,MultiToolUse-claude-3-7-sonnet-20250219,miniwob,miniwob,aman,Dragging items,"Avoid dragging items outside the grid. Ensure the drop coordinates are within valid grid boundaries, or the task will fail."
June 11,miniwob.drag-items-grid,30,claude-3-7-sonnet-20250219,MultiToolUse-claude-3-7-sonnet-20250219,miniwob,miniwob,aman,Dragging items,"Grid items are reactive: dragging an item over another may cause them to swap. Only perform mouse_down when the dragged item is correctly positioned. Intermediate movement helps trigger these reactive behaviors reliably."
June 11,miniwob.drag-items-grid,30,claude-3-7-sonnet-20250219,MultiToolUse-claude-3-7-sonnet-20250219,miniwob,miniwob,aman,Dragging items,"Use intermediate positions when moving items. This often leads to more stable behavior than dragging directly to the final target."
June 11,miniwob.drag-items-grid,30,claude-3-7-sonnet-20250219,MultiToolUse-claude-3-7-sonnet-20250219,miniwob,miniwob,aman,Dragging items,"Hovering near a target item can prompt it to move to an adjacent grid cell. Use this behavior to clear the destination before dropping the dragged item"
June 11,miniwob.drag-items-grid,30,claude-3-7-sonnet-20250219,MultiToolUse-claude-3-7-sonnet-20250219,miniwob,miniwob,aman,Dragging items,"Move items along slightly curved instead of straight lines to better imitate human-like dragging behavior."
June 11,miniwob.drag-items,30,claude-3-7-sonnet-20250219,MultiToolUse-claude-3-7-sonnet-20250219,miniwob,miniwob,aman,Dragging items,"Move items along slightly curved instead of straight lines to better imitate human-like dragging behavior."
June 11,miniwob.drag-items,30,claude-3-7-sonnet-20250219,MultiToolUse-claude-3-7-sonnet-20250219,miniwob,miniwob,aman,Dragging items,"For dragging tasks, use only mouse_down, move_mouse, and mouse_up. Do not perform a single continuous drag. Instead, move the mouse in steps using move_mouse, and then release with mouse_up when the target is reached."
June 18,miniwob.count-shape,23,claude-3-7-sonnet-20250219,MultiToolUse-claude-3-7-sonnet-20250219,miniwob,miniwob,allac,Shape and letters size comparison in miniwob,"Shapes or items have different colors and different size. Size is relative to the other objects in the white area and is either ""large"" or ""small"". Shapes that are larger than the average shape or letter are considered ""large"". Others are ""small""."
June 18,miniwob.count-shape,23,claude-3-7-sonnet-20250219,MultiToolUse-claude-3-7-sonnet-20250219,miniwob,miniwob,allac,communicate answer in miniwob,Answer by clicking one of the buttons describing multiple choices.
June 18,miniwob.count-shape,23,claude-3-7-sonnet-20250219,MultiToolUse-claude-3-7-sonnet-20250219,miniwob,miniwob,allac,Simbols of colors in miniwob,"Colors a distinct in this task, e.g., cyan is not a type of blue. "
June 18,miniwob.form-sequence-2,23,claude-3-7-sonnet-20250219,MultiToolUse-claude-3-7-sonnet-20250219,miniwob,miniwob,allac,Reporting results in miniwob,Make sure to click submit to finish the task.
June 19,miniwob.use-colorwheel-2,15,claude-3-7-sonnet-20250219,MultiToolUse-claude-3-7-sonnet-20250219,miniwob,miniwob,hadi,Invisible elements,"Make sure submit button is visible by clicking on some empty space before clicking submit."
June 19,miniwob.click-scroll-list,1,claude-3-7-sonnet-20250219,MultiToolUse-claude-3-7-sonnet-20250219,miniwob,miniwob,hadi,Scrolling lists,"Lists are not always alphabetically ordered."
June 19,miniwob.click-scroll-list,1,claude-3-7-sonnet-20250219,MultiToolUse-claude-3-7-sonnet-20250219,miniwob,miniwob,hadi,Scrolling lists,"Hold Command to select multiple items as soon as you find any of them."
June 19,miniwob.daily-calendar,26,claude-3-7-sonnet-20250219,MultiToolUse-claude-3-7-sonnet-20250219,miniwob,miniwob,hadi,Calendar,"Use click and drag to choose a timeslot not equal to 60 minutes."
June 19,miniwob.daily-calendar,26,claude-3-7-sonnet-20250219,MultiToolUse-claude-3-7-sonnet-20250219,miniwob,miniwob,hadi,Calendar,"If the Create or Cancel buttons were not visible, try to scroll down a bit."
June 19,miniwob.daily-calendar,26,claude-3-7-sonnet-20250219,MultiToolUse-claude-3-7-sonnet-20250219,miniwob,miniwob,hadi,Calendar,"Before naming the event, make sure the time slot is correct."
June 19,miniwob.social-media-all,23,claude-3-7-sonnet-20250219,MultiToolUse-claude-3-7-sonnet-20250219,miniwob,miniwob,hadi,Sharing and scrolling,"If you scroll long enough, you don't have to scroll after each step."